{
  "schema_version": "1.0.0",
  "request_id": "11111111-1111-4111-8111-111111111111",
  "run_id": "33333333-3333-4333-8333-333333333333",
  "comparison_group_id": "44444444-4444-4444-8444-444444444444",
  "compute_location": "local",
  "status": "completed",
  "created_at": "2026-10-04T12:01:00Z",
  "config_sha256": "cccccccccccccccccccccccccccccccccccccccccccccccccccccccccccccccc",
  "engine": {
    "name": "RunnerAnalysisKit",
    "version": "0.1.0",
    "models": [
      {
        "name": "HRNetRunnerWholeBody23",
        "sha256": "d9377a55247a6675ce9b643a2e7a3eb4ed6d929669332c013077a76b0315c75b",
        "compute_units": "cpuAndNeuralEngine"
      }
    ]
  },
  "input_videos": [
    {
      "camera_index": 0,
      "sha256": "aaaaaaaaaaaaaaaaaaaaaaaaaaaaaaaaaaaaaaaaaaaaaaaaaaaaaaaaaaaaaaaa"
    }
  ],
  "coordinate_system": {
    "pose2d_origin": "top_left",
    "x_axis": "right",
    "y_axis": "down",
    "pose2d_unit": "original_video_pixel",
    "bbox_format": "x1_y1_x2_y2",
    "joint_order": ["nose", "left_eye", "right_eye", "left_ear", "right_ear", "left_shoulder", "right_shoulder", "left_elbow", "right_elbow", "left_wrist", "right_wrist", "left_hip", "right_hip", "left_knee", "right_knee", "left_ankle", "right_ankle", "left_big_toe", "left_small_toe", "left_heel", "right_big_toe", "right_small_toe", "right_heel"]
  },
  "stages": [
    {"name": "validating", "status": "completed", "duration_seconds": 0.1, "warnings": []},
    {"name": "pose2d", "status": "completed", "duration_seconds": 26.4, "warnings": []},
    {"name": "pose3d", "status": "skipped", "duration_seconds": null, "warnings": ["Not implemented in Local V1 milestone"]}
  ],
  "summary": {
    "total_time_seconds": 12.13,
    "average_speed_mps": 8.7,
    "average_acceleration_mps2": 0.4,
    "detected_steps": 14,
    "average_cadence_spm": 281.56,
    "average_step_length_m": 1.85
  },
  "artifacts": [
    {
      "artifact_id": "55555555-5555-4555-8555-555555555555",
      "type": "metrics",
      "media_type": "text/csv",
      "relative_path": "metrics.csv",
      "sha256": "bbbbbbbbbbbbbbbbbbbbbbbbbbbbbbbbbbbbbbbbbbbbbbbbbbbbbbbbbbbbbbbb",
      "size_bytes": 2048,
      "camera_index": null
    }
  ],
  "warnings": []
}
